#metadataBlock	name	dataverseAlias	displayName													
	enrichments		Enriched Metadata													
#datasetField	name	title	description	watermark	 fieldType	displayOrder	displayFormat	advancedSearchField	allowControlledVocabulary	allowmultiples	facetable	displayoncreate	required	parent	metadatablock_id	termURI
	ELSSTTerm	ELSST Term	This element contains a relevant term from the European Language Social Science Thesaurus.		text	0		TRUE	FALSE	TRUE	TRUE	FALSE	FALSE		enrichments	
	cbsVariableVocURL	CBS Variable Vocubulary URL	This element contains the relevant Vocabulary URL for a variable used in a CBS dataset.		text	1		TRUE	FALSE	TRUE	TRUE	FALSE	FALSE		enrichments	
	cbsThemaVocURL	CBS Theme Vocubulary URL	This element contains the relevant Vocabulary URL for a theme used in a CBS dataset.		text	2		TRUE	FALSE	TRUE	TRUE	FALSE	FALSE		enrichments	
	cbsTrefwoordVocURL	CBS Theme Vocubulary URL	This element contains the relevant Vocabulary URL for a keyword used in a CBS dataset.		text	3		TRUE	FALSE	TRUE	TRUE	FALSE	FALSE		enrichments	
